{
  "$schema": "http://json-schema.org/draft-07/schema#",
  "additionalProperties": false,
  "definitions": {
    "CapitalType": {
      "enum": [
        "company",
        "countryBudget",
        "countryDebt",
        "countryIncome"
      ],
      "type": "string"
    }
  },
  "properties": {
    "$schema": {
      "type": "string"
    },
    "datasets": {
      "items": {
        "type": "string"
      },
      "type": "array"
    },
    "description": {
      "type": "string"
    },
    "name": {
      "type": "string"
    },
    "type": {
      "$ref": "#/definitions/CapitalType"
    }
  },
  "required": [
    "$schema",
    "datasets",
    "name",
    "type"
  ],
  "type": "object"
}