{
  "$schema": "../../schemas/CapitalMetadata.schema.json",
  "type": "company",
  "name": "Nvidia",
  "description": "Nvidia Corporation is an American multinational technology company incorporated in Delaware and based in Santa Clara, California. It designs graphics processing units (GPUs) for gaming and professional markets, as well as system on a chip units (SoCs) for the mobile computing and automotive markets.",
  "datasets": ["2025Q1"]
}
